url,Publication_name,reference_doc
https://www.thrillist.com/drink/washington-dc/washington-dc-sunday-funday-10-spots-to-day-drink-in-dc,Thrillist,"Turn laundry, gym, and call-your-dad day into an adventure that can transport you to far-off lands like New England, Spain, and wherever a Margaritaville still operates. All it takes is the right amount of day drinking and a festive atmosphere. We’ve rounded up some old favorites and fresh picks for your next Sunday Funday.
Union MarketThe signature silver bean of a bar that produces some of the best frozen drinks in the city is now open outside Union Market. Find it by looking for the NFL-grade turf, lawn games, flip cup table, and buzzed clientele holding sticky summer shandies made from beer, lemonade, and fresh ginger. Suburbia offers 10 beers on tap plus two draft cocktails and buckets of beer whenever they’re open, but Sundays are special. That’s when they bust out experimental Bloody Mary cocktails and sell them two-for-one. Suburbia opens Sundays at 11am.
SW WaterfrontCantina Marina’s Margaritaville atmosphere means you’ll feel more like you’re on vacation and less like you’re putting off errands. The guilt subsides even further when your first ""Escalade Margarita"" arrives. That’s the frozen margarita that comes with a mini bottle of Grand Marnier, just because. Another bonus to Sunday Funday? Corona-ritas are only $10. Bring the pup and tackle some Super Nachos by the water. Open Sundays at 11:30am.
14th StreetUsually the clock has to strike 6pm to enjoy 2 Birds, 1 Stone. That’s no longer the case on Sundays, when the doors swing open at 3pm for what they call ""6 ways 2 Sunday."" Six cocktails from Adam Bernbach are on offer -- several acknowledge you’re drinking during daylight, like the michelada and Irish coffee. Bring a group of Sunday Funday friends and split the Airmail-in-Carafe ($34), which contains dark rum, sparkling wine, honey, lime, and bitters.
TrinidadEverything is intense at Bardo Brewpub in Northeast. It’s gargantuan in size, and the beer list reads like a quirky novel. A good Sunday Funday session beer is the Australian-style Bunbaberg Ginger Beer, because it’s boosted with pounds of fresh ginger instead of hops. Bardo is also obsessed with aging beers in chestnut oak. Work your way through the rotating selection of 16 drafts starting at 1pm on Sundays. Note that Bardo could be much bigger by summer’s end. The team behind the brewpub is gearing up to open a two-acre beer garden and dog park near Nationals Park.
U StreetGetting time on the Vinoteca courtyard bocce court means you’re practically Sunday Funday royalty. Everyone sipping amari spritzes and eyeing the court wants to be you. But they’re not, because you promptly arrived at 11am when the court opens on Sundays. Relish in that as you throw a few in between bites of fancy dogs and pitchers of sparkling sangria. This year’s grill line-up includes duck sausage topped with slaw and Korean chili mayo and a Columbian-style dog topped with grilled pineapple dubbed ""Miss Universe.""
14th StreetThe weather’s not going to bring it's A-game every week, so make sure to cue up some rainy-day retreats. Black Jack, for example, goes on happy hour pricing all day Sundays from 3-10pm. Think $7 pizza and burgers and $10 buckets of beer all throughout the afternoon. The best deal, however, is the $25 bucket of fried chicken, bacon-braised greens, spicy coleslaw, and jalapeño corn muffins. Having a picnic in a bar means no busted tan lines or ants, and the Nats game will probably be on.
U StreetThis place is a hipster bingo card: can beer, Mason jars, local sausage, Narragansett lager, pickles, and bar food with adorable names (""swatchos,"" anyone?). That being said, it can be a low-key Sunday-hang that’s only a fraction less crowded than Dacha or Garden District. In addition to the swine-topped nachos, try the half-smoke that hails from nearby 13th Street Meats. Open Sundays at 1pm.
Dupont CircleYou, your swim trunks, and a cocktail belong on the roof of the newly renovated Embassy Row Hotel. Sure, you have to pay $25 for a day pass, but all will be forgiven after your first hour of lounging in luxury with a view. The bar opens at 11am Sundays, and they’ll serve drinks and snacks off the new Station Kitchen & Cocktails menu. If you want to wait it out, roof access is free after 5pm. Just no ticking people off in the cabanas by doing your best cannonball.
Capitol HillStart Sunday Funday off with Hank’s ""Hangover Juice,"" which will fix the fact that last night ended with Fireball. It combats a thumping headache with rum, falernum, carrot, orange, coconut water, and cayenne. Then you’ll be ready for mix-and-match bottomless drinks until 4pm for $15. Nosh on lobster rolls, popcorn shrimp, Bloody Mary oyster shooters, and more to curate a Cape Cod-like afternoon. Both the restaurant and The Eddy Bar open at 11am on Sundays.
Navy YardThis is your Sunday Funday option if you accidentally bought too many $14 cocktails on 14th St last night, because it’s dirt cheap. The Spanish import boasts a menu with 100 (duh) mini-sandwiches priced at $1.50-$3.00 each. Nibble on them on the sunny patio while kicking off a serious sangria session. Five types are available by-the-mug for $4, or pitcher for $10, and buckets of beer are just as cheap. It's open Sundays at 11am.
Sign up here for our daily DC email and be the first to get all the food/drink/fun in town."
https://www.eater.com/2020/4/17/21224994/christina-tosis-baking-club-is-the-best-thing-on-instagram-for-families,Eater,"Since the stay-at-home order started for us, the same day we moved from Los Angeles to Austin, there have been few things upon which my eight-year-old son and I can agree. From how much screen time he should get, whether or not he still needs to practice his handwriting, and even the importance of not riding his bike in the middle of the street (“Mom, the cars can’t hit me because of social distancing”), it’s safe to say in the age of quarantine, we haven’t exactly seen eye to eye. But then, #bakingclub came along.
I’ve baked with Cooper before, and despite some disagreements about frosting to cake ratios and whether his little brother should be allowed to participate, it’s typically an activity that brings us both joy. At one point when he was a toddler, I even dreamt of opening my own bakery; I now chalk that idea up to postpartum hormones. When I saw that Tosi, whom I came to love after watching her episode of Chef’s Table, was starting her quarantine baking club on Instagram, something sparked for me. Could we do this, he and I? Would it ease the daily tension? I figured at the very least I’d be able to say we did math and science for the day, and maybe get a cookie or two out of it. Little did I know that Tosi and her #bakingclub would become the glue holding our lives together.
My son knows Tosi not as a James Beard award-winning pastry chef, but rather as one of the judges on MasterChef Junior, a show perfectly suited for her warmth and positivity. So when I introduced the idea of doing #bakingclub with him, he was on board. She was familiar, knowledgeable, and because of her, we were going to have dessert for the first time in a week.
And so we began. For those who’re unfamiliar with #bakingclub, here’s how it works: Each afternoon Tosi posts a set of ingredients for the next day. Flour, salt, eggs, sugar, and butter are predictable mainstays. There are also wild cards thrown into the mix. Cereal, potato chips, ramen noodles, and grape jelly have made appearances, always leaving us rife with anticipation for what the next #bakingclub creation will be. And then, like clockwork, at 2 pm EST the following day, there she is.
She greets us with a dance, to the beat of the day’s playlist, which she also puts on Spotify. Madonna, Dolly Parton, Survivor, The Beach Boys… each day a different mix as we gather our ingredients and wash our hands while singing happy birthday to some of her followers. In the hands of someone else, the novelty may have worn off after the first couple of days. But with Tosi, that’s not the case. In fact, as the days go on, #bakingclub has become our not-so-secret ingredient for what she calls the secret to life: “always having something to look forward to.” And judging by the numbers, I’d say we’re not alone.
On day four of baking club I noted her Instagram following was hovering at 393,000 followers. Just 11 days later, she had 408,000 (and counting). It’s not only the recipes, which have proven to be delightfully simple and always delicious (save for a savory day when making tortillas fell a bit, well, flat, in my household). It’s not just the consistency of her process: ingredients, music, recipe, baked goods. It’s not just her over-the-top adorable dog, Butter, who typically makes daily appearances — though she certainly helps.
She shows up everyday, enthusiastic to make  the most of our time together, as if there’s nowhere else she’d rather be. She reminds us that it’s okay if we don’t have all the ingredients; there are always swaps to be made, it doesn’t have to be perfect. It’s the way she bebops around her kitchen, looking as precious as a grown woman possibly can in overalls while being decidedly not precious about her baking.
It’s been a long time since a public figure has brought me this kind of comfort. I was a senior at NYU in 2001 and lived just blocks away from where the Twin Towers fell. I remember how my roommate and I would wearily navigate each day as best we could. Some days we’d go to class, some days we wouldn’t. Some days we’d cry, some days we wouldn’t. But every night, we’d watch the Late Show with David Letterman, finding comfort and security in the way he navigated the fear and uncertainty of the time with a careful mix of humor, compassion, and his own raw emotion. While the COVID-19 pandemic and 9/11 aren’t exactly comparable, I’m finding similar relief in watching and baking along with Tosi. She’s giving us something reliable when the world is anything but.
I imagine that, as the days drag on, my son and I won’t magically start agreeing on how best to spend them. But I do have hope that he’ll eventually look back on this quarantine and think about our time together in the kitchen, dancing and baking our way through the 2 o’clock hour with Tosi and the rest of the #bakingclub."
https://www.timeout.com/usa/news/book-an-epic-little-mermaid-inspired-stay-in-malibu-053023,Timeout,"Calling all The Little Mermaid superfans: now’s your chance to spend a night in a Malibu Beach house inspired by the under-the-sea world of the beloved movie. But you’ll have to act fast—just three of these experiences are available, and the spots will open up for booking on June 7 at noon ET.
To celebrate the release of the new live-action movie in theaters, Disney and Booking.com have partnered up to offer this one-of-a-kind overnight stay that will fully immerse you into the world of The Little Mermaid. The beach house—which sleeps two—has been transformed into a Disney-level wonderland with rooms featuring decor inspired by Ariel, Ursula, King Triton and Prince Eric. Guests will also enjoy a private dinner with a personal chef, a screening of the movie at a nearby theater and more surprises. Flights and airport transportation are included. You’ll get all this for the magical price of $5.26 (in honor of the date the movie hit theaters).
Booking will be available at this Booking.com link on June 7 at noon ET, and the three separate overnight stays will take place June 9, 10 and 11. If you don’t manage to grab a spot, Booking.com has a few suggestions for seaside and beachfront stays available on the site that have a Little Mermaid vibe, like Atlantis, The Palm in Dubai, Beach Plum Resort in Montauk, Lighthouse on La Palma Island in Spain and Aleria Luxury Cave Santorini in Greece."
https://www.thrillist.com/eat/new-york/michelin-star-restaurants-in-nyc-cheapest-new-york-options,Thrillist,"The Michelin brand is alternately known for quality tires, a cuddly mascot, and one of the most coveted accolades in the service industry, depending on your kink. The French rubber manufacturer first entered the ratings racket over a century-and-a-half ago in a bid to sell more tires. Since then, the anonymously curated honor -- one star for good, two for excellent, and three for exceptional -- has struck love and loathing in the hearts of chefs all over the world.
Michelin-starred restaurants are, with few exceptions, expensive. A typical dinner at some of the guide’s top-tiered eateries in New York can run hundreds of dollars per person. And, after a month of NYC Restaurant Week deals, you’ll be accustomed to eating better for less. Depending on what time you choose to eat or where you sit, a Michelin-approved meal can actually be within reach. We did the math and found 15 spots where you can eat extravagantly and even have enough money left over for a drink.
It is possible to indulge in Eleven Madison Park without a reservation or a trust fund -- provided you can snag one of six seats at the bar. Last year’s renovation truncated the drop-in space, and chef Daniel Humm’s à la carte menu remains succinct. The refreshed lounge is as luxe as ever, and the tiny bar affords an opportunity for slightly less-monied New Yorkers to catch a glimpse and a taste of the best restaurant in the world. Mix and match the prawn, the crab salad, the honey and lavender glazed duck, or the black and white cookies and sample one of the city’s most expensive menus for around $100.
Eat well, do good, and save money -- that sums up the City Harvest lunch at chef Eric Ripert's revered French restaurant. Available weekdays at Le Bernardin's lofty front lounge, the three courses not only offer a budget-friendly taste of Ripert's award-winning seafood preparations (ingredients change weekly), but $5 from every meal also gets donated to the menu's namesake nonprofit.
At $68 for two courses, lunch at Jean-Georges Vongerichten's Central Park gem feels like a downright steal when compared to the $148 dinner (it's a whopping $238 for the tasting of JG signatures). Diners will find many of the same premium dishes, too, like yellowfin tuna ribbons, spicy peekytoe crab salad, or, for an extra $12, four small themed desserts (chocolate, tropical, etc.).
After longtime executive chef Gabriel Kreuther left to open his eponymous restaurant (which received a one-star nod), Danny Meyer tapped Abram Bissell to lead the kitchen at The Modern, a move that gave it a Michelin bump. The two-star venue offers a by-the-dish menu in its expansive bar room -- an economical place to sample Bissell's playful, ingredient-focused fare for less. Most items run less than $30 each, like the avocado with peekytoe crab, the green garlic gnocchi, and the spicy steak tartare.
Jungsik’s unadvertised à la carte menu is available first come, first served at the bar. Instead of paying $155 for the seasonal prix fixe, you can combine the branzino, octopus and sea urchin for $90. And, unlike at a table where every guest is required to partake of the tasting, you can even split the bill with a pal.
The $58 two-course power lunch at Michael White's pricey Midtown establishment is nearly half the cost of the most expensive dinner entree, a $102 whole branzino for two. The options are also quite extensive, with your choice of crudi or antipasti to start, followed by several pastas or proteins, like the strozzapreti with jumbo lump crab, the fusilli with octopus bone marrow, the seared sea scallops, and the pan-roasted dover sole.
No time (or cash) for the sit-down tasting at Daniel Boulud's double-starred flagship? Snag a seat in the bar and lounge room, where you can sample surprisingly generous dishes à la carte, some hovering around $50. It'll feel like a more leisurely affair here, but the staff doesn't skimp on hospitality -- you'll be getting the same winning service as prix fixe diners, plus an elegant, jazzy ambience.
Tucked away inside Grand Central Terminal, you'll find the new-Nordic restaurant from chefs Claus Meyer and Gunnar Gíslason showcasing locally farmed ingredients. A separate à la carte menu means you can feast on forono beets and Pennsylvanian lamb shank for $45 -- $100 less than the nightly tasting menu.
At $75, chef Patti Jackson's prix fixe menu is already one of the best deals in town, but further savings can be had by dining in Delaware and Hudson's Tavern extension right next door. Jackson also draws inspiration from the Mid-Atlantic region for the pub menu, turning out dishes like spaetzle and schnitzel to go with large-format beers from the region.
The strategy here is easy: you, the bar, an $18 tarte flambée, a $35 half-bottle of riesling, and a languid afternoon. With its cozy white leather banquettes and comprehensive menu -- including a long, award-winning wine list -- the lounge at Gabriel Kreuther is as fine as the dining room. Drop by the dessert annex for pastry chef Marc Aumont’s beautiful chocolate bonbons and petite desserts.
Don't be fooled by the fancy, white-tablecloth interior of the sprawling restaurant inside Chelsea's Maritime Hotel -- prices, while on the high side, aren't completely out of reach. Dine at the barroom Tapas Bar, where chef Anthony Sasso -- who garnered a Michelin sparkler at Casa Mono -- has put together a menu of creative Spanish-influenced small plates. A four-course menu featuring dishes like crispy fairy tale eggplant, garganelli with veal ragu, duck breast, and tiramisu runs $72 per person.
Not only is the afternoon a good time to eat on the cheap at this pristine fish den, it's also when you get the best deal overall -- and the proof is in the math. The nighttime sushi omakase costs $65 for 10 pieces; the lunch option is $35 for seven pieces, plus half a roll. Average that out and the nigiri rings up to $6.50 each at dinner, but only $5 each at lunch -- and that's not even counting the extra half-roll.
At $69, Carbone's veal Parm may be out of budget, but order smartly with a friend at Mario Carbone and Rich Torrisi's retro red sauce palace and you’ll get away with dining for less than $50 each. An appetizer (chopped salad, $21), pasta (spicy rigatoni vodka, $32), and meat (cherry pepper ribs, $38) comes out to $45.50 person -- plus, the portions are as extravagant as the prices, so you'll likely be walking out with leftovers.
Lunch is the best time to eat affordably at this New American mainstay helmed by Alfred Portale. Entrees max out at $28 for dishes that will actually fill you up: pan-roasted chicken, soft shell crabs, and the Gotham burger -- fries included. There's also Gotham's greenmarket lunch, a $38 three-course meal highlighting ingredients sourced from the nearby Union Square farmers market.
The plates at Alex Raij and Eder Montero's beloved Brooklyn tapas joint are meant to be shared, so pool your dinner budget with some friends and you can can cobble together an excellent Spanish spread -- ranging from $4 spiced chickpeas to $32 roasted suckling pig -- at a pretty reasonable rate."
https://www.thrillist.com/news/nation/what-is-candy-corn-supposed-to-taste-like,Thrillist,"When it comes to Halloween candy, few sugary handouts are as polarizing as candy corn.
It's basically the Peeps of fall. Although you've eaten, spit it out, or flat-out refused to touch it countless times in your life, there's a good chance ""sugary"" or ""bad"" are the only words you can think of to describe its flavor. But it turns out the true flavor of candy corn is markedly more complex. Really.
If you think about it, the classic kernel-shaped candy doesn't taste like any one specific thing (and it certainly tastes nothing like corn, despite its name), which likely explains all the sugar-fueled speculation over the years. So, what the hell is candy corn actually supposed to taste like (other than cavities)? The ingredients list doesn't offer many clues. Most of the candy corn products we looked at are made mostly of sugar, corn syrup, artificial flavorings, various artificial colorings, and soy protein as well as carnauba wax, presumably for texture.
In 2016, we contacted what's perhaps one of the greatest authorities on the subject, The Jelly Belly Candy Company. You might associate Jelly Belly with jelly beans, but the sweets giant actually got its start making candy corn and other mellocreme/buttercream candies at the turn of the 20th Century as the Goelitz Confectionery Company. It's been making the tricolored sugar triangles ever since.
""Candy Corn was modeled after corn in shape, but not taste. The actual flavor of Jelly Belly’s (formerly known by the family name, Goelitz) Candy Corn is a wonderful blend of creamy fondant, rich marshmallow, and warm vanilla notes. When combined, these flavors create the distinct Candy Corn flavor. The texture is as important as the flavor. Our Candy Corn is creamy and smooth; never coarse. It should be like biting into butter.""
Wow. Consider our minds blown.
Candy corn is supposed to have marshmallow, vanilla, and buttery caramel-like flavor notes, which combine to form that super-sweet, unique, and often polarizing candy corn flavor. The reason why it's called candy corn is also incredibly simple: It's modeled after the shape of a corn kernel, according to the spokesperson. Really makes you want to eat some candy corn now, doesn't it? Okay, okay, maybe not."
https://www.thrillist.com/news/new-york/jane-hotel-closing-transforms-members-only-club,Thrillist,"It's the end of an era in the NYC nightclub scene. The Jane Hotel is officially closing its doors, or rather, it is only keeping them open for a select few.
After being sold to hotelier and owner of Monkey Bar and City Club Jeff Klein back in February, The Jane is now set to become a members-only hotspot under the new ownership. The venue will become one of Klein's San Vicente Bungalows club locations, which are membership-based clubs that originally opened in West Hollywood.
Before becoming official, the news had been rumored since the sale. In February, a public liquor license application reported that Klein was requesting the existing license for the Jane Hotel to be transferred to the Jane St. Social Club Inc., described as a ""members-only establishment to be located in the same building.""
The hotel was originally built for sailors in 1908, and later became a celebrity-favorite hotspot before giving way to NYC's party-oriented college students and young professionals. To this day, the hotel is still a go-to nightlife hotspot for many.
Luckily, New Yorkers have another 10 days to say their goodbyes. November 19 will be the last night when everybody will be able to dance under the iconic disco ball, and on the day after, the Jane Hotel will officially close and get ready for its next chapter.
To stay up to date with events and celebrations during the club's last few days, you can head over to their Instagram page."
https://www.timeout.com/newyork/news/shake-shack-is-collaborating-with-milk-bar-on-a-new-line-of-shakes-083121,Timeout,"New York culinary icons Shake Shack and Milk Bar are teaming up for a delicious collaboration: two limited-edition shakes. Offering a unique merging of both brands’ distinctive strengths, fans will be able to choose between the chocolate birthday cake shake and cornflake drizzle shake starting this week.
The shakes formally launch nationwide, and for pickup and delivery through Shake Shack’s website or app, starting Friday, September 3 through November 1. However, dedicated fans can use the Shack App to exclusively snag the limited-edition shakes starting Tuesday, August 31. And if your birthday is coming up soon, you might be in luck. To celebrate the new collaboration, Shake Shack is giving away free shakes to lucky fans in honor of their birthdays. Every Friday in September, fans can head to Shake Shack’s Instagram Stories (@shakeshack), where they’ll use the B’Day Randomizer to select random calendar dates. If your birthday is selected, be one of the first 50 followers to slide into Shake Shack’s DMs, and they’ll send a discount code for a free shake via the Shack app."
https://www.thrillist.com/news/new-york/justfoodfordogs-opens-first-kitchen-nyc-upper-west-side,Thrillist,"New York City has a dining spot for every cuisine and now that's even true for canine cuisine.
JustFoodForDogs, the veterinarian-based and approved brand offering human-grade food for your four-legged friends, has just opened a new store and kitchen concept on the Upper West Side.
The brand aims to feed dogs with curated and healthy recipes that are backed by science and veterinarians. JustFoodForDogs prides itself on being made with 100% USDA-certified ingredients, which include common items that are usually sitting in your (human) fridge. Think of beef russet potatoes and venison squash, and all the kinds of meats and vegetables that you would cook for yourself. JustFoodForDogs uses the same ingredients, and instead caters them to your pet with tasty and healthy recipes.
The new JustFoodForDogs location, which you can find at 2025 Broadway, is the first and only standalone kitchen for dogs in New York. Altogether, it is the 41st kitchen the brand has opened in the US.
For more information and to see where the other kitchens are located, you can visit the brand's website."
