url,Publication_name,reference_doc
https://www.thrillist.com/drink/new-orleans/mid-city/where-to-drink-in-mid-city-new-orleans,Thrillist,"In the 504, those who like to go out and get into their cups (pretty much everyone, really) know that not all neighborhoods are created equal when it comes to imbibing. The hip kids and transplants love the Marigny and the Bywater, Magazine St has a wild variety of watering holes, and of course the French Quarter is the French Quarter. So while it’s not the new hotness of Freret St, Mid-City is coming up in a big way. If you’re headed that way -- as well you should -- here are the spots to hit for a great night out.
RedemptionWhat do you do when you buy an old church in the Crescent City? Turn it into a bar and restaurant, of course.  But a nice bar and restaurant. If you’re looking for a lovely glass of vino or a classic cocktail in Mid-City, this is your spot.
Finn McCool’s Irish PubSoccer hooligans of the Big Easy, unite at Finn’s! (Or, actually, don't?) There are other sports displayed on the 8ft TV, of course, but few seem more appropriate here than, ahem, “football”, paired with a properly poured pint of Guinness. Also, 'dogs, darts, and killer food courtesy of Boo Koo BBQ.
Twelve Mile LimitWhat to say about this place other than, if you happen to be there at 4pm on a Sunday afternoon, you can get both a haircut AND a drink for all of 10 bucks? Well, also that there’s free food on Mondays. Oh, and Shortall’s BBQ to chow down on from Tuesday-Friday.
Mick’s Irish PubSports, sports, and more sports! And pool, and smoking, and general debauchery. In all the best ways, this is the place to go if you want to give your liver a run for its money.
Parkview Tavern (Mid-City Watering Hole)If you don’t know exactly what Parkview is just by looking at the name, you probably should move on.  But if you really need a primer: it’s a true neighborhood bar with a great patio and free food during Saints games.
Banks Street Bar & GrillWhat, you thought all the music in New Orleans lived downtown? Head to Banks Street for an eclectic lineup of bands throughout the week, from blues to bluegrass, rockabilly, Cajun and more, always for free with no cover charge. Because music is for the masses, man!
TrèoIt might be a newcomer to the Mid-City scene, but Treo (opened by the owners of Finn McCool’s) brings inventive craft cocktails and small plates to a neighborhood that’s traditionally been more of a po-boy, beer-and-a-shot kind of place.
The BulldogLike its Uptown sister, the Mid-City Bulldog is known for having an outstanding beer selection (which is vast, at 160 and counting, incl. vaunted rarities like Mikkeller and Clown Shoes), if a somewhat jocular vibe. And dogs, of course. Always dogs.
Bayou Beer GardenWith a huge and beautiful outdoor deck (there’s a waterfall!), the BBG is literally made for drinking outside. It’s a great spot if you’re partying with a sizable group, or to kill it at pub trivia.
The bar formerly known as McNulty’s Bitter EndOkay, so, technically speaking, it’s now called Bob Roth’s Lounge, but we’ll always know it as McNulty’s. Or Par Fours, or La Lena’s, Amoure’s Island, L.G.’s Rendezvous, or any number of its names since the mid-1950s. An old-school dive bar with zero BS and even less pretension, little has changed about the place -- from the classic rock on the radio to the ratty old pool tables to its regulars -- in decades. Well, aside from the name."
https://www.thrillist.com/lifestyle/new-york/empire-state-building-run-up-race,Thrillist,"New Yorkers love a challenge. So, it should come as no surprise that every year more than a hundred athletes willingly embark on the brutal journey of running to almost the tippy top of the Empire State Building.
Celebrating its 45th anniversary, the Empire State Building Run-Up claims the title as the first-ever tower run, as well as the most notorious. Requiring a combination of mental and physical toughness, the race kicks off at 8 pm on October 4 and is certainly not for the faint of heart. While it only takes a single minute for visitors of the Empire State Building to reach the 86th floor Observatory via elevator, the fastest runners making their way up via the staircase cross the finish line at about 10 minutes.
Due to limited space and safety precautions, spectators aren’t allowed to watch along the route, but designated spotters call out floor numbers and offer words of encouragement to passing runners.
This year’s registration closed over the summer, but if you’re keen to join next year’s adventure, online admittance is first-come, first-served and costs $125 per person to enter.
Additionally, this year’s registration proceeds go towards the Challenged Athletes Foundation, which empowers athletes with physical disabilities through sports and fitness.
Final times aside, every participant in the race leaves with an unforgettable sense of accomplishment, a commemorative medal, and, of course, endless bragging rights.
The Empire State Building Run-Up will be held at the Empire State Building on October 4 at 8 pm."
https://www.timeout.com/newyork/news/the-worlds-largest-gingerbread-village-is-returning-to-manhattan-110422,Timeout,"See the spectacular GingerBread Lane display at Essex Market.
When Jon Lovitch made his first gingerbread village as a teenager in Kansas City in 1994, he could never have dreamed that he’d someday turn the hobby into his full-time job, display his creations in New York City and set the world record for gingerbread houses.
Fast forward 28 years, and the “Gingerbread Man,” who holds the Guinness World Record for largest gingerbread village, is ready to unveil GingerBread Lane at Essex Market on the Lower East Side later this month. The spectacular display will return to Manhattan after heading outside of the city for two years amid the pandemic.
This year, Lovitch is making about 1,500 gingerbread houses, with 500 each going to displays in New York City, Salt Lake City and Kansas City. The village includes precious details, like jelly bean roof tiles, candy cane decor and clever signs made out of icing. It takes 1,000 pounds of gingerbread and 8,000 pounds of icing to create 1,500 gingerbread houses, along with the help of several hardworking dehumidifiers to keep everything dry.
The process takes all year with the season ramping up to 100-hour weeks in the fall when the air constantly smells sweet and gingerbread houses cram into every nook and cranny of his basement in Queens.
For Lovitch, this year-round project is truly a labor of love. He uses the knowledge and work ethic he developed as a professional chef working in some of America’s most coveted hotel kitchens to push through the challenges of creating such intricately detailed, time-consuming work.
After each season, he gives away the gingerbread houses for people to display at their own homes. While the houses are made mostly of food items, they are not edible, he cautions, especially considering many of the materials are expired.
As soon as the holiday season ends, he’s on the lookout for discounted, expired candy to use for next year’s display, delighted to score things like boxes of candy canes for 10 cents or jelly beans from 2018. When the winter solstice rolls around even before the year 2023 begins, he’ll start making next year’s GingerBread Lane.
Lovitch’s passion for the project began when he was working as an apprentice chef at a hotel in Kansas City where the pastry chef made a gingerbread house. He noticed visitors’ positive reactions to the chef’s creation, so he wanted to try his hand at making his own. That first year in 1994 as a teenager, he made 14 gingerbread houses, what he’d now consider a small display.
Over the years as he lived in different cities for work, including Washington, D.C. and Pittsburgh, he’d display the growing GingerBread Lane in those cities as well. It even found a home at the Smithsonian for a while.
When he moved to New York City and saw a news article about the world’s largest gingerbread village, he realized his was actually larger. So he set out to provide the proper documentation to Guinness World Records, which certified his epic gingerbread village as the world’s biggest.
Each year, he pretends to be a regular visitor to GingerBread Lane, so he can hear people’s unfiltered reactions.
See GingerBread Lane at Essex Market on the Lower East Side from Saturday, November 26 through Sunday, January 15."
https://www.eater.com/2016/4/19/11459564/chick-fil-a-a-list-loyalty-program,Eater,"Some say the best things in life are free, but sometimes getting those free things proves awfully difficult. Chick-Fil-A has a loyalty program for its customers, but many may not be aware because the program is apparently super-exclusive — members have to be invited to join. Perks of being one of the chosen few include free meals, behind-the-scenes tours, and other giveaways, according to CNBC.
Plenty of other chains have loyalty programs, albeit not ones nearly as secretive as Chick-Fil-A's: Starbucks has recently taken some heat for overhauling its own wildly popular rewards program."
https://www.thrillist.com/news/nation/anthony-bourdain-final-parts-unknown-episode-from-france-will-not-air,Thrillist,"Last June, at age 61, Bourdain took his own life in a hotel room in France.
At the time, he was shooting a new segment for his food and travel show, Parts Unknown, with fellow chef Eric Ripert. And while the show's production company, Zero Point Zero, has released a final season of the show airing right now on CNN, the last episode will take place in New York City's Lower East Side. That is to say, the episode he was filming in Alsace, France just prior to his death will not air.
Throughout the course of this season, Bourdain eats, talks, and ingratiates himself with locals in Kenya, Asturias, Indonesia, and Far West Texas before hitting Manhattan. Still, the absence of that one missing piece is felt. In the un-released Alsace segment, Ripert was intended to shepherd Bourdain to vineyards, restaurants, and food markets along the French-German border. They hadn't made it everywhere, but they'd certainly begun.
When news broke of Bourdain's death, he and Ripert had just wrapped a scene in which they sat together, over plates of food, across from Chef Jean-Yves Schillinger. Schillinger later toldPEOPLE that Bourdain was “just like himself, just like he was on television” that day.
Unfortunately, that footage will remain private. We can all listen to Bourdain wax poetic about the salty, the acrid, and the sour one final time on the streets of New York on Sunday, November 11 (9pm ET on CNN). This will be our final tour de force -- our last opportunity to see something new, produced at the hands of Bourdain."
https://www.timeout.com/usa/news/the-worlds-largest-corn-maze-unveils-a-new-theme-for-2023-101223,Timeout,"It’s corn maze season, and farms across the country have carved intricate designs into their corn fields so you can get lost in them. You may have heard about the mazes celebrating country star Reba McEntire, but what does the farm that’s home to the world’s largest corn maze have up its sleeve this year? Dinos. That’s right, the massive maze at Richardson Adventure Farm is Jurassic Park-themed.
The 28-acre cornfield is located in Spring Grove, Illinois, about 65 miles northwest of Chicago. The maze includes 10 miles of trails that form the Jurassic Park design. You don’t have to walk all 10 though—the maze is divided up into four smaller mazes, with easily accessible exits. Throughout the maze you’ll find wooden bridge checkpoints where you can take a break, enjoy the views and figure out where you are. Once you’re done, you can enjoy hot chocolate, donuts and other activities like train rides and ziplining.
Tickets for the maze, open through October, are $24 on Thursdays and Fridays and $30 on Saturdays and Sundays. Children 13 and under are $20 and $24 respectively. The maze is closed Monday to Wednesday. At the end of October, the farm will host Maze ‘til Midnight hours so you can tackle the trails in the moonlight.
Find more information and tickets on the farm’s website."
https://www.thrillist.com/news/new-york/standard-high-line-bumper-cars-pop-up,Thrillist,"Add one more winter attraction to your must-visit list if you're in NYC's Meatpacking District this holiday season.
BUMP!, a bumper cars pop-up, is officially opening at the plaza of the Standard High Line Hotel. The retro-styled attraction is modeled after '80s punk culture, promising a ""downtown, DIY attitude"" for guests. Tickets will costs you $20 for an 8–10 minute ride, and of course, you can always grab food at The Standard Plaza as well.
BUMP! is open seven days a week, depending on weather. It runs 12 pm–10 pm from Monday through Friday and 11 am–10 pm on Saturdays and Sundays. Riders must be at least 7 years old, over 42 inches tall, and weigh less than 300 pounds to ride.
You can find more information here."
https://www.timeout.com/newyork/news/a-new-kitchen-for-dogs-only-just-opened-on-the-upper-west-side-100622,Timeout,"It’s basically a Michelin-starred outing for dogs.
It was only a matter of time until our puppies got the New York City treatment: Just Food For Dogs is a new store and kitchen concept serving canine food made with 100% USDA-certified ingredients.
The shop actually opened back in June but the eatery officially started welcoming puppies last week, offering them ""human quality"" food prepared by trained chefs. According to Patch, the space is anchored by a bodega-style deli counter where owners can order menu items that include a tofu and quinoa dish with sweet potatoes, kale, white mushrooms and blueberries or a beef and Russet potato recipe that comes with carrots, green peas, beans, apples and more. It's basically a Michelin-starred outing for dogs.
Patch reports that Just Food For Dogs ""says it is the only whole-dog food company to have commissioned digestibility studies at a major university, and the only to conduct systematic feeding trails on all daily canine recipes.""
Although the company already operates over 40 locations around the country, this is actually the first ever kitchen to open in New York.
City dwellers taking care of furry friends at home are also probably familiar with another dog-approved destination in the neighborhood: Black Lab Cafe, which opened back in June at 420 Amsterdam Avenue by West 80th Street.
The venue, at 2025 Broadway by West 70th Street on the Upper West Side of Manhattan, serves food and drinks to both humans and dogs. The former get to enjoy Stone Street coffee and espresso drinks while the latter dive into Clean Bowl Club NYC food, the canine food company operated by the same owners of Black Lab Cafe.
While we're at it: here's our list of the best dog-friendly restaurants in NYC (although we're sure any true puppy lover has these all marked up already)."
https://www.thrillist.com/news/new-york/nyc-first-aapi-parade,Thrillist,"This weekend, New York City is in full parade mode. On Saturday, the Big Apple will be home to its first ever Japan Parade, while on Sunday, May 15, the Asian American Pacific Islander Heritage Parade will debut its first annual iteration.
Beginning on 6th Avenue and West 44th Street, the AAPI Heritage Parade will kick off at 10:45 am and wind its way north for 10 blocks on 6th Avenue.
In honor of Asian American & Pacific Islander Heritage Month, the event is also aimed at celebrating diversity in culture after the uptick in race-based hate crimes during the pandemic. In 2021 alone, violence and hate crimes targeting Asian communities have increased by 343%, the New York Police Department statistics show.
""Asian American Pacific Islander Heritage Month celebrates New Yorkers who contribute to the rich culture that makes New York the greatest city in the world,"" Mayor Eric Adams said in an official parade announcement. ""As we work to combat a spike in hate crimes, it is important to support and uplift our AAPI brothers and sisters.""
Starting this year, AAPI culture will be honored and celebrated regularly in NYC together with many other communities and heritages.
""When I first came to New York City, working as a peddler in Manhattan, I remember being amazed at the Puerto Rican Day Parade, the St. Patrick's Day Parade, and the Columbus Day Parade,"" John Park, founder of the Korean American Community Empowerment Council, said in an official statement. ""I never dreamed I would one day lead Korean New Yorkers down Sixth Avenue for the first Asian Pacific American Heritage Parade.""
It's a historical event for the whole community. ""This parade signifies a historical moment where Asian, South Asian, and Pacific Islander Americans all come together at the heart of our diverse city to celebrate cultures and traditions while amplifying our voice in unity,"" Dr. Bindu Babu, event co-chair of the Asian American and Pacific Islander Cultural and Heritage, said in an official statement."
https://www.thrillist.com/news/new-york/worlds-largest-gingerbread-village-nyc,Thrillist,"The sweetest village of them all is officially back in NYC.
After a pandemic-related two-year hiatus that saw it relocated outside the Big Apple, a massive gingerbread village is coming back to Essex Market in the Lower East Side. As determined by Guinness World Records for many years, the gingerbread village holds the title for being the world's largest, and it is ready to welcome visitors to admire its grandeur.
The village, dubbed GingerBread Lane, is the prized work of chef and creator Jon Lovitch, who designs, bakes, and constructs it every year. According to TimeOut New York, the NYC village flaunts 500 gingerbread houses, which are meticulously decorated with jelly bean roof tiles, candy canes, and icing structures.
GingerBread Lane will be on display at Essex Market through Sunday, January 15. For more information, you can visit the market's website."
https://www.thrillist.com/news/new-york/tolls-fare-hike-nj-ny,Thrillist,"Starting this week, your wallets might become a little lighter when traveling from New Jersey to NYC. A toll hike, which was originally approved by the Port Authority in December as an adjustment for inflation, just went into effect on Sunday.
Now, commuters will have to shell out one extra dollar per trip at select crossings, including the Lincoln and Holland tunnels, the Outerbridge Crossing, and the George Washington, Bayonne, and Goethals Bridges.
Cars will now have to pay a peak hour toll of $14.75, while the updated off-peak fare is now $12.75. Car drivers who use toll by mail instead of the usual E-ZPass will instead be charged $17."
https://www.eater.com/2017/8/15/16150432/taco-bell-naked-egg-taco-shell,Eater,"Taco Bell continues its work in the very important field of developing alternative taco wrappers: Its newest menu item is a breakfast taco with a fried egg standing in for a tortilla. Called the Naked Egg Taco, the pliable shell is made entirely of egg and sandwiches a filling of potatoes, cheese, and bacon or sausage.
It’s slated to hit menus nationwide on August 31 for $1.99, following an initial test run in Michigan that began back in the spring. The Naked Egg Taco follows in the footsteps of the fried chicken shell taco, which was a big hit until the limited-run item was yanked from the menu back in February.
Taco Bell’s other recent innovations in breakfast taco shells have included waffles and biscuits, so this newest item may pique the interest of carb-avoidant fast food fans."
https://www.timeout.com/news/finland-is-offering-free-trips-to-teach-people-how-to-be-happy-032423,Timeout,"Let's be honest, the past few years haven't been the easiest. With viruses, wars, and financial pressures, a lot of us have really had to put the work in to feel happy. But through it all, Finland upheld its title as the world’s happiest country for six consecutive years.
The Nordic country topped the UN's World Happiness Report 2023, which looks at nations’ average income, mental and physical health, freedom, and more.
Finns really seem to know what they are doing when it comes to this whole happiness thing – and now the country has announced that it will finally share its secret recipe for joy.
That’s right: Finland is offering ten people a four-day Masterclass of Happiness at the luxurious Kuru Resort, completely free of charge. Participants will stay in villas surrounded by pine forests and scenic views, each with its own private spa and sauna.
The masterclass will take place between June 12 and June 15, during which the lucky bunch will learn from leading experts on happiness. The experts will teach the group how to find their inner balance and how to connect with nature and themselves.
Those who would like to throw their hat in the ring have to submit an online application on the Find Your Inner Finn website, before completing their social media challenge. All you'll have to do is create some content on Instagram or TikTok explaining what makes you believe you might secretly be a Finn and why you want to join the masterclass, shared with the hashtags #FindYourInnerFinn and #VisitFinland. You have until April 2 to complete it all.
‘Now we want to help people find and master that Finnish state of mind. We’ve chosen the best coaches, one of the most breath-taking resorts in Finland, and a time in the early summer amid the beautiful Finnish nature for our masterclass,’ he added.
Sounds pretty good to us. May the best joy-seeker win.
Did you hear that the EU is giving away 35,000 free train tickets?
Stay in the loop: sign up to our free Time Out Travel newsletter for the latest travel news and the best stuff happening across the world."
