url,Publication_name,reference_doc
https://www.timeout.com/newyork/news/nycs-biggest-club-opens-this-weekend-052022,Timeout,"Musica comes from Italy and is backed by Cipriani and Italian nightclub owner Tito Pinton.
The largest nightclub in New York City opens its doors to the public this weekend with the hopes of heralding a return to NYC nightlife in the biggest way possible.
The new club, Musica, opens in Hell's Kitchen at 637 West 50th Street with 25,000 square feet of space, including ""The Whisper Room"" lounge on its ground floor, a main floor and an open-air rooftop.
The Whisper Room has an opulent lounge with a bar, stage, private green room, kitchen, private luxury booths and state-of-the-art lighting and sound while the main floor has a giant event space comprised of three areas—two bars, a VIP lounge, cocktail lounge, intelligent lighting, and sound system. The rooftop has views of the Hudson River.
Musica is a joint project between Giuseppe Cipriani and Italian entrepreneur Tito Pinton, who owns the il Muretto club near Venice, Italy. Both of them worked with nightlife guru Rocco Ancarola and Francesco Belcaro of the Made in Italy Group to plan entertainment and musical performances, ""providing New Yorkers with a nightlife experience unlike ever before,"" a release says.
Musica debuted in Italy first before coming to the U.S.
""We have been overwhelmed by the response to Musica in Italy and are so grateful that our service and entertainment is resonating so strongly with locals, celebrities, and industry elite alike,"" Pinton said in a statement. ""We are so excited to bring the energy we’re known for in Italy to one of the top nightlife destinations.""
On Saturday, its grand opening features Nic Fanciulli, Malone and resident DJs Hector Romero and Sasha Bardot. Check out its Instagram account to find out who's performing.
Musica opens on Saturday, May 21, at 637 West 50th Street and will be open Thursday-Saturday, 11pm-4am."
https://www.timeout.com/new-orleans/hotels/where-to-stay-in-new-orleans,Timeout,"Not sure where to stay in the Big Easy? Fret not; our guide to the best places to stay in New Orleans will put you on the right path to an unforgettable getaway. NOLA is much more than the French Quarter, but don’t take that as a dismissal of its most famous neighborhood; love cafes, you’ll be swooning there.
With a location that positively hugs the Mississippi River, New Orleans is a jumble of fascinating neighborhoods that offer everything from family-run restaurants to debauchery and excess in spades. Wherever you choose to stay in New Orleans, you are in for a great time, but a little knowledge goes a long way.
The French Quarter is the city’s oldest and best-known neighborhood. Most visitors make a beeline to Bourbon Street, and many first-timers think the Quarter is nothing but a party. But there’s a lot more to do here - gorgeous architecture, a ton of history, fabulous antiques, local boutiques, great food, music, and views of the Mississippi. It’s family-friendly, with the Aquarium of the Americas, the Cabildo Museum, carriage rides, street performers, and more fun for kids. Stay here if you want to be in the middle of it all, with easy access to other neighborhoods.
While the Quarter is home to newer, award-winning restaurants, dining at one of New Orleans’ historic fine dining institutions is a must. Galatoire’s offers a glimpse into the city’s unique dining culture; most of the waiters, dressed in tuxedos, are local and have worked at the restaurant for decades, and many high-society locals are longtime regulars. The bright walls, black-and-white tile, and white tablecloths serve a refined but celebratory atmosphere. Dine on shrimp rémoulade, trout almondine, and other New Orleans classics for a memorable experience.
Located in the century-old Creole restaurant Arnaud’s, the French 75 bar offers a step back in time. The dark, intimate space is adorned with monkey lamps and other original vintage decor. Order a classic cocktail like an Old Fashioned or a sidecar, or ask the expert bartenders for an inventive concoction. Either way, you’ll be impressed. Try the soufflé potatoes, an Arnaud’s specialty, then check out the intriguing Mardi Gras museum upstairs.
Running parallel to Bourbon Street, one block over is one of the Quarter’s most elegant routes. From Canal to Esplanade, you’ll find a beautiful stretch of art galleries, antique shops, fine jewelry, street performers, and picturesque buildings adorned with intricate ironwork. For a unique experience, check out M.S. Rau Antiques. The 25,000-square-foot gallery features an incredible collection of high-end antiques, art, and sculpture. Ask to see the “secret room”, and you’ll be amazed at the rare, museum-quality artifacts on display.
Family-owned and operated since 1886, the Monteleone is one of the most recognized hotels in the city. Its opulent rooms were favored by writers such as Anne Rice, Truman Capote, Tennessee Williams, and William Faulkner. The star of the hotel is the Carousel Bar. Locals and tourists frequent this revolving bar for classic cocktails and musical entertainment. It’s a must-do on any visitor’s list, and as a guest, you can imbibe to your heart’s content and stroll right onto your room. You can also enjoy a meal at Criollo, with its ingredient-driven menu presenting the fusion of flavors that make up Louisiana cuisine.
Get beignets and cafe au lait at Cafe du Monde. Enjoy an order on the covered outdoor area and watch the crowds go by on Decatur, or take it to go and sit on the edge of the Mississippi. Your visit to the Quarter isn’t complete unless you’re covered in powdered sugar at some point.
Downriver from the French Quarter, across Esplanade Avenue, are two of the trendiest neighborhoods in the city, frequently referred to as one continuous neighborhood. The young and the hip are drawn to this area, attracting an ever-increasing in-the-know crowd. Hotel chains have yet to invade, but there are several bed and breakfasts and a couple of smaller inns to consider. The furthest reaches of Bywater are best accessed with a cab or rideshare, but the energetic can safely walk through the area during daylight. You’ll find colorful Creole cottages and historic homes containing small cafes and shops, a few art galleries and hip record stores, and the riverfront Crescent Park. Restaurants are local and casual, with a smattering of vegan-friendly spots along St. Claude Avenue. Bars run the gamut from the classy Three Muses to the divey Hi-Ho Lounge. The epicenter is Frenchmen Street; you’ll find live music venues where you can hear anything from jazz or blues to reggae and rock or even a brass band performing on a corner. It’s still crowded but a more unique alternative to the Quarter.
Perched above the bustling Frenchmen Street, up a narrow flight of stairs from the Apple Barrel bar, is this quaint, cash-only restaurant serving Creole Italian—a local specialty combining Italian and local French influences. Enjoy huge portions of seafood and pasta as you check out the quirky, colorful decor. Be prepared for a wait, and bring cash.
While it’s no longer a locals’ secret, Bacchanal retains its unique local charm and funky hideaway feel. At the far end of the Bywater, you’ll find this wine shop/hangout with a cozy “treehouse” bar and lush back patio. Pick a bottle and a cheese plate or one of several gourmet small plate offerings and listen to a live band. It’s like a party at your friend’s house every night of the week.
Experience joy, art, and music at this interactive installation in the Marigny. The 5,500 square-foot warehouse space has been converted into a selfie haven with bright, colorful rooms designed by local artists, celebrating local art, music, and culture. Jump into a pot with a giant crawfish, snap a pic with an oversized bust of local musicians, and become part of the art in virtual reality booths. It’s sensory overload, New Orleans style.
Hotel Peter & Paul sits in a building that used to be a Catholic church and school but has since been reimagined into one of NOLA’s most stunning places to stay. If the gingham-clad rooms don’t win you over, with their antique furniture and snazzily-tiled bathrooms, perhaps The Elysian Bar will: this is one of the hottest places to drink in the city.
Support live, local music on Frenchmen. Whether it’s a brass band at d.b.a, reggae at Cafe Negril, or trad jazz at Snug Harbor (to name just a few), experience the music up close. You can also stop in Louisiana Music Factory to take home some tunes from your favorite local artists.
The CBD, just across Canal Street from the French Quarter, contains the bulk of New Orleans office buildings and includes the Warehouse District and the so-called South Market District. Typically the go-to area for travelers conducting business in the city, it has blossomed into a hip hub for food, drink, and culture. The Warehouse District, which began its transformation in the late '80s, is now a full-on arts district with renowned art galleries and museums. The CBD also includes the Orpheum and Saenger Theaters and the Superdome - home of the New Orleans Saints. You’ll find a wealth of places geared towards office workers for a quick, inexpensive bite, along with some of the city’s most talked-about restaurants, including Cochon, Peche, and Emeril’s. Younger travelers will be drawn to cool hotels with rooftop bars like the Ace, Moxy, and Troubadour, as well as renowned landmark hotels like The Roosevelt, Windsor Court, and Le Pavillon. For a more modern vibe and trendier offerings, the CBD is a good choice for its walkability and proximity to the French Quarter.
A smaller spinoff of chefs Donald Link and Stephen Stryjewski’s famed Cochon, Butcher has now come into its own as a top destination for a Cajun-influenced, meat-centric meal. Grab a deli sandwich at the counter or take home house-made meats, sausages, terrines, pickles, sauces, and jams. Don't miss out on taking some Andouille and Tasso home with you.
This elegant bar within the landmark Roosevelt Hotel was a favorite of Huey Long’s. Sidle up to the long wood bar, order a sazerac or a Ramos gin fizz, and admire the famous Paul Ninas murals. A New Orleans icon, the Sazerac Bar has long been one of the city’s most popular pre- or post-meal gathering spots for friends, families, and business dealings.
“Gallery Row” on Julia Street in the Warehouse District is a series of more than a dozen art galleries occupying former storefronts. The architecture creates a unique setting for browsing classic and cutting-edge art. On the first Saturday of every month, galleries host coordinated openings with a festive atmosphere. White Linen Night - held on the first Saturday in August - is the premier event, when hundreds of people come out in white linen to enjoy art, food, and music.
The Virgin Hotel brings even more hip cred to the CBD, offering relaxing digs within walking distance of the Quarter. Rooms are chic and comfortable, and there is plenty to explore around the hotel. Hang at the rooftop Pool Club and enjoy a cocktail and views of the city, grab a coffee in the Funny Library, or have dinner at Commons Club. The Virgin is pet friendly too.
Visit the National WWII Museum, a world-class complex with award-winning exhibits showcasing the stories of those who served in WWII and on the homefront. Highlights include a theater with WWII-era musical performances, a restaurant, and a fantastic gift shop with 1940s-inspired gifts and clothing.
This area of the city—encompassing several smaller, residential neighborhoods upriver from the French Quarter - includes the St. Charles Avenue streetcar, grand historic mansions, Tulane and Loyola Universities, the beautiful Audubon Park and Zoo, and many beloved local institutions. It’s away from the hubbub of the French Quarter, offering the culture without the craziness, but easily accessible by various modes of transportation. During Mardi Gras, it is a great place to be, as the parades roll down St. Charles in an exceptionally family-friendly environment. You’ll find neighborhood cafes, po-boy shops, long-running family restaurants, and several popular spots for sno-balls, New Orleans’ favorite summertime treat. You can enjoy pleasant walks, grand oak trees, and unique shopping. As you move further to Uptown, passing scores of grand Garden District mansions (which you can learn about by taking a guided walking tour), you’ll find a mix of high-end restaurants (Commander’s Palace) and colorful neighborhood dives (Parasol’s).
This century-plus Victorian cottage tucked away in the Riverbend houses some of the best modern Creole fare in the city. Chef Frank Brigtsen straightforwardly updates classic dishes with delicious results. Perfect after enjoying a stroll through the surrounding neighborhood, Brigtsen's is a smart option for sampling New Orleans cooking in an intimate, friendly setting.
Head to the outskirts of the Irish Channel on Tchoupitoulas Street to sample a wide selection of innovative, locally-influenced craft beers. Take a tour, then hang out in the convivial taproom for pints of standards like Hopitoulas and Irish Channel Stout or seasonal taproom-only flavors like hibiscus ginger.
Tip’s is a destination for music lovers, but even the disinterested will get swept up in the vibe. This funky space has been a landmark since 1977 for live music and weekly Cajun dancing sessions. The standing-room-only space is perfect for seeing a local band while soaking up some musical history. The associated Tipitina’s Foundation supports local musicians and maintains an excellent Walk of Fame on the sidewalk.
This Victorian-era mansion on St. Charles Avenue was lovingly renovated by the team behind popular spots Sylvain and Barrel Proof. With only 14 guest rooms, you will feel right at home in rooms featuring soaking tubs and local art. Relax on the front porch and watch the streetcars go by, or dine at the on-site restaurant, which features a contemporary take on New Orleans classics.
Head to Magazine Street—six miles of unique local shops, art galleries, neighborhood bars, popular restaurants, and colorful architecture.
For a real neighborhood adventure away from—but accessible to—the French Quarter, consider Mid-City. Midway between the Mississippi River and Lake Pontchartrain, it offers easy access to both destinations via streetcar or taxi/rideshare. For the overachievers, the Lafitte Greenway, a 2.6-mile paved trail, is a bikeable option to the Quarter. Mid-City is a strong, diverse, local community home to the famous annual Jazz and Heritage Festival. You’ll find an artsy crowd and colorful houses in the Bayou St. John area and historic landmarks along Bayou Road. There is a thriving commercial corridor along Carrollton Avenue, and several classic bars, restaurants, breweries, and sno-ball stands everywhere. Many Mid-City families have been based in the area for generations. If you’re a repeat visitor and want a more local experience, Mid-City is a good choice.
This family-owned, casual neighborhood joint is a top choice for classic, overstuffed po-boys. It has grown in popularity, but the friendly staff still takes care of the locals while welcoming tourists. Shrimp are fried to perfection, roast beef is sufficiently messy, and the Barq's (and beer) is served icy cold. For a non-traditional po-boy option, try the smoked alligator sausage.
This Irish pub with local flavor is one of the top neighborhood bars in the city. Lively and totally unpretentious, you’ll feel like a regular as soon as you order your first beer. It is a lively gathering spot for Saints and soccer games, and their weekly pub quiz night is particularly raucous. The pop-up kitchen in the back serves decent pub grub too.
City Park is a beautifully-landscaped, 1,300-acre green space filled with moss-drenched oaks, peaceful walking paths, and native birds. Within the park are the New Orleans Museum of Art, the Botanical Gardens, and golf, both mini- and regular. The Big Lake offers boating and other activities, while Storyland and the Carousel Gardens Amusement Park offer fun for kids.
This charming B&B on Canal Street offers easy access to the streetcar. The elegant decor is original to the home, and the homemade breakfasts are filling. With comfortable parlors and a garden terrace, it is a quiet, homey place to unwind after exploring the city.
Head to Chickie Wah Wah for live music from an intimate stage. You can see jazz, funk, roots rock and select touring acts at this small club. There's always a great vibe whoever takes to the stage."
https://www.thrillist.com/news/nation/dairy-queen-closed-manhattan-location,Thrillist,"As a New York transplant, I get an occasional pang of homesickness cured only by a visit to the grungy East Village bar that shows Cubs games or a blizzard dinner at the 14th Street Dairy Queen. But now, a piece of my midwestern soul has died right along with DQ's Union Square outpost.
The dipped cone maker has permanently closed its only Manhattan location following a six-year stint near Union Square, Time Out confirmed with company reps earlier this week. The two-story, 2,500sqft restaurant, which was reportedly boarded up in May, will not reopen despite the buzz surrounding its 2014 debut.
But for those of you who require that perfect soft serve blend for survival (me), I've got good news: you can still get that blizzard fix. The Illinois-born ice cream joint has three remaining locations in NYC: two on Staten Island and one in the Bronx.
This isn't the only landmark loss we've seen in New York City as a result of the coronavirus pandemic. After 17 Big Mac-slinging years, McDonald's 42nd Street flagship shuttered, as well.
""McDonald’s reviews its restaurant portfolio on a regular basis to make the best decisions for our business moving forward,” the company said in a statement shared with Thrillist and other media outlets. ""The closing of the 42nd [Street] Times Square restaurant, which was planned before the pandemic, was a difficult decision, and allows us to focus on serving customers a few blocks away at the new flagship McDonald’s on 45th and Broadway and in the neighboring communities."""
https://www.thrillist.com/news/new-york/karens-diner-opening-nyc-location,Thrillist,"In March, a unique new restaurant will open its doors in NYC. Here, if you ask to see the manager, you'll be served a hamburger instead.
Karen's Diner, an already popular brand with locations across the United States, United Kingdom, and Australia, is opening a pop-up diner in NYC's very own West Village. The restaurant prides itself on its ""terrible service,"" and the name says it all. Get ready to be served by a bunch of Karens, who are set to be as ungrateful as the popular jokes and memes portray them to be.
The food—luckily—will be much better. Burgers and hot dogs are on the menu, and guests can expect to catch a few funny names when deciding what to eat. The ""I Want to See the Manager"" Karen burger will delight you with two Wagyu patties, Swiss cheese, bacon, lettuce, pickles, and BBQ-mustard sauce, while the Karen's Got Real Beef features overnight slow cooked smokey BBQ beef brisket, bacon, coleslaw, caramelized onion, and honey glazed BBQ sauce.
You can also choose from a variety of tasty sides to accompany your main dish. From mozzarellas sticks and onion rings to halloumi fries and loaded cheesy beef brisket, there's something for everyone. Delicious desserts are also on the menu, and beer and wine are available as well.Karen'ser in NYC is opening on March 1, and it will welcome hungry diners throughout the end of the year. To give the diner a try, you need to purchase tickets, which are $35 each. It is encouraged to reserve them in advance, which you can do right here."
https://www.thrillist.com/news/new-york/gordon-ramsay-opening-first-nyc-fish-chips-restaurant,Thrillist,"British expats in NYC will soon feel closer to home, while every other New Yorker will be catapulted to the UK.
Gordon Ramsay's famous restaurant brand Fish & Chips is coming to the Big Apple for the first time, and it will plant its roots in the heart of Times Square. Delicious fish & chips will be served, featuring a modern take on the UK favorite.
The new fast-casual restaurant will be located at 1500 Broadway, and Ramsay himself is thrilled to bring such an addition to the NYC food scene.
""Fish & chips was a staple for me growing up in the UK, and I can't wait to bring it to New York City,"" the chef said in a statement. ""I love the vibrance, the energy of Times Square and the convergence of locals and visitors from around the world. There's just no place like it!""
Guests will be able to order from a long list of tasty items. Besides fish & chips—the star of the menu made with sustainable true cod—the restaurant will offer a variety of fried seafood, such as fried shrimp and lobster, as well as fried chicken for turf fans. A specialty sandwich—dubbed ""Fishwich""—will also be served, and it will feature crispy fried cod in naan bread.
Those looking for a tasty snack to munch on can order a plate of fries from the ""Just Chips"" menu, which features a list of ""dirty"" fries. They come with a combination of toppings, like jalapeño, chorizo, cotija cheese, red onion, chives, and parsley or truffle, and more.
Patrons craving something sweet can rest assured: the menu has dessert too. Among the options, customers can find Sticky Toffee Pudding and even a Biscoff flavored milkshake.
For more information and to peruse the menu in other locations, you can visit the Fish & Chips website."
https://www.thrillist.com/news/new-york/old-catskill-game-farm-for-sale-upstate-new-york,Thrillist,"If you were really inspired by the 2011 Matt Damon film We Bought a Zoo, we have some good news for you.
The Catskill Game Farm, a 193-acre former petting zoo and animal breeding facility, is up for sale. Located in Catskill, New York, the property is about two-and-a-half hours north of New York City by car. It began as a family-owned petting zoo in the 1930s—becoming America's first privately owned zoo—and operated until 2006. At its height, the property was home to over 2,000 animals, including the viral phenomenon April the giraffe.
In 2012, a couple purchased the former zoo and began to reimagine it as a resort property they renamed The Old Game Farm. They set up glamping sites (which are still available to book via Tentrr) and renovated the former giraffe barn into a boutique hotel called the Long Neck Inn. They couple sold to a group of investors in late 2020, who planned to bring animals back to the property and add attractions like mountain biking and archery.
Now, the former zoo is for sale once again via Corcoran Country Living. The listing emphasizes residential development opportunities on the massive property, with an asking price of $3.6 million. Reached for comment by Thrillist, Corcoran agent Jeanne Rakowski said she envisions the property will likely appeal most to developers.
""We have camp inquiries, glamping inquiries, adventurous type settings, but we think it's gonna lean towards a residential development,"" she said, adding that the property's size, location, and zoning would likely be appealing. ""It's nostalgic. It's smack in the center of Kingston, Saugerties, Woodstock, Catskill. It's right off the Thruway. It's zoned well... Properties like this are few and far between."""
