url,Publication_name,reference_doc
https://www.timeout.com/newyork/news/antons-is-serving-25-cent-martinis-and-manhattans-all-month-long-011922,Timeout,"Grab a VERY cheap cocktail at the West Village restaurant through the end of January.
We'e a big fan of Anton's—but we're particularly in love with the West Village restaurant this month, given its latest promotion: 25 cent martinis and manhattans all month long. We'll drink to that!
Yes, we know it's Dry January... but can you resist such a price tag? Just to be extra clear: the downtown spot will be serving full-sized cocktails for a quarter of a dollar during its lunch service every weekday through January 31. See you there?
Alas, if you're sticking to your dry January resolution, we applaud you and are here to help. Check out these five cocktails that we made with zero-proof spirits from local shop Spirited Away, a new downtown destination that might actually convince you to forego alcohol all together.
Whether you're having alcohol or not this month, congratulations on (almost!) making it through one of the most depressing months of the year!"
https://www.timeout.com/newyork/news/a-mini-japanese-marketplace-is-opening-in-brooklyn-090722,Timeout,"Make your own dashi packs, buy some ceramics, and try a nine-course omakase tasting menu.
Soon, you’ll be able to experience the tastes of Japan without ever leaving Brooklyn.
When 50 Norman opens in Greenpoint on Friday, September 16, it’ll bring a Japanese multi-retail and dining mini-complex to the neighborhood.
Acclaimed Japanese architect Jo Nagasaka designed the 3,500-square-foot space featuring reclaimed woods from demolished old houses in Kyoto as a way to bring the essence of Japan to Brooklyn. 50 Norman will house three well-respected brands from Tokyo making their debut in New York.
Up your home design with ceramics, kitchenware, zen meditation items, and art pieces at Cibone (that’s pronounced Cee-Bo-Nay). The shop promises lifestyle and artisanal goods that represent classic and contemporary Japanese craftsmanship. Cibone will highlight items that are not mechanically mass-produced, but instead edited and archived by the team, born from the mind of an artist or by craftspeople conveying the traditions of Japan.
Dubbing itself as The Natural Broth Shop, Dashi Okume is the only specialty shop in the U.S. where you can custom order your own blends of dashi packs. You’ll be able to choose from a combination of ingredients from around 30 choices. Dashi Okume also carries retail products such as ready-made dashi packs, frozen dried fish, and dashi soy-sauce kits, alongside a casual dining experience serving comforting Japanese meals.
Debuting about a month after its counterparts, mark your calendar for House Brooklyn’s opening in late October. This eight-seat Japanese French restaurant by Kyoto native Chef Yuji Tani will offer delicate yet innovative Japanese French cuisine served as a nine-course omakase tasting menu. Chizuko Niikawa of Sake Discoveries has prepared a sake list, Brooklyn restaurant Four Horsemen is handling the wine list, and the tea pros at Kettl are curating a tea list."
https://www.timeout.com/newyork/news/a-pop-up-balloon-museum-is-opening-in-nyc-next-month-091923,Timeout,"You’ve never seen inflatables quite like these.
Following successful runs in Madrid, Milan, Paris and Rome, the Balloon Museum has taken over Pier 36 in The Seaport.
Set in and outside of the 80,000-square-foot space, the new cultural destination debuted on October 27 with a new exhibit titled “Let’s Fly,” scheduled to run through January 14, 2024.
Expect a variety of installations created by 18 different international artists and media studios to be on display, each one pertaining to the importance of modern art and exploring the nature of inflatables. Visitors are encouraged to interact with the art, touching and feeling the various pieces exhibited. Basically, the exact opposite of the “don’t touch the art” mantra that dominates trips to more traditional museums.
Among the showcased artists will be muralist Camila Falsini, Sasha Frolova (she's the one responsible for the inflatable latex sculptures you won't stop staring at) and Cyril Lancelin, among others.
In terms of actual pieces, you can expect a 4,000-square-foot ball pit, inflatable lava lamps and the sorts of infinity rooms that you'll itch to post about on Instagram.
It will take you about 90 minutes to do the entire experience, which includes stops at different rooms and the occasional use of VR sets.
One more thing: after looking through the pictures, the pop-up experience may seem a bit familiar—that’s because the destination made an appearance on the last season of Netflix’s hit TV show Emily in Paris.
Tickets for the show are available right here starting at $41."
https://www.timeout.com/usa/news/these-are-the-cheapest-luxury-hotels-in-every-state-120822,Timeout,"Yes, it’s a contradiction but we just want champagne upon check-in.
Is it a paradox wrapped in an enigma to say that we want to stay in a luxury hotel, but we want it to be inexpensive?
According to CashNetUSA, many factors have made it easier for people without a gold card to access stays in four and five star hotels. Luxury is more in reach—and upscale rooms can be had for under $200. And there’s now a helpful list of the cheapest one-night stays in a five-star hotel in each of the 50 states, as well as 10 bonus big cities. Sounds like a fun way to build a road trip! Before we get to the nitty-gritty of the list, here are some of the interesting takeaways.
The cheapest luxury hotel in the US, coming in at a mere $73, is the four-star DoubleTree by Hilton Deadwood at Cadillac Jack’s in South Dakota. Phew! Based on that name, bring your ammo. The cheapest luxury hotel in a big city is the five-star Signia San Jose in California, where you can snag a fancy room for $309. The list is pretty eye-opening: we see a Ritz Carlton and a few Four Seasons locations on the list, many DoubleTree chains, and a dotting of singular hotels like The Breakwater Inn and Spa in Kennebunkport, ME (four stars, $218) and the Topnotch Resort in Stowe, VT (four stars, $350).
Some states, alas, do not have five-star hotels (including, gasp, Connecticut), and so four-stars pad out the list. On the other end of the spectrum, Wyoming’s cheapest luxury lodging was quite expensive—check out (since you may not be able to check in) the Four Seasons Resort Jackson Hotel at (cough) $2,805.
If you’re looking at the bright lights of Vegas, the five-star ARIA Resort & Casino comes in at $179, and if you’re curious about Hawaii’s deals, the five-star Fairmont Orchid Gold Experience is $909. So there’s a lot of fluidity in these prices!
As for that fantasy road trip, hitting each hotel on the list, you’d only need $17,581 to be pampered until it (pleasantly) hurts—and interesting, the best route between the hotels is 17,476 miles… so your miles and dollars are about the same. But of course, gas will set you back.
To see the full list and read about the methodology, click here.
Join Time Out NYC editor, Shaye Weaver, as she drives a sauna boat and cold plunges into Lake Zurich."
https://www.theinfatuation.com/new-york/cuisines/southeast-asian,Theinfatuation,"A tour of South Asian restaurants, bakeries, and cafes in Queens from a Bengali restaurateur and native borough enthusiast.
Grab a walk-in table at this Southeast Asian restaurant in the Village when you don’t want to wait anywhere else.
Pretend you’re at a Bali beach party at this small plate seafood restaurant in Nolita.
53's stylish dining rooms should be studied at Parsons. This modern Asian restaurant in Midtown from the Marea team is one of your best options for an upscale dinner in the city.
Pig And Khao is a Thai/Filipino restaurant on the LES that serves great food and feels like a party.
NY Dosas serves legendary vegan South Indian food from a cart in Washington Square Park.
All of Shahana Hanif’s recommendations for teheri, chapati, fuchka, and more in the neighborhood.
A tour of South Asian restaurants, bakeries, and cafes in Queens from a Bengali restaurateur and native borough enthusiast.
LuAnne’s Wild Ginger is a very solid vegan Pan-Asian spot in Fort Greene.
Sama Street is a Pan-Asian bar and restaurant in Greenpoint that’s a great place to go for cocktails and small plates.
The Tyger serves fantastic food from a variety of Southeast Asian countries in a bright Soho space that’s good for groups.
Angkor on the UES is running takeout, delivery, and outdoor dining service until August 1st - here’s what to order.
The Num Pang location near Grand Central is a great option for a quick lunch in the area.
Wild Ink is an expensive, sceney spot in Hudson Yards that serves inventive Asian-inspired food."
https://www.theinfatuation.com/new-york/features/uncle-boons-is-closing-for-good-nyc,Theinfatuation,"After nearly seven years in Nolita, one of the best Thai spots in the city announced that it’s closing down. In a statement today, co-owners Ann Redding and Matt Danzer said, “COVID-19 has rocked our industry to the core, and we — a small, family-owned business — are no more immune to the realities that threaten restaurants, than any other shop. Despite our good standing, we were not able to reach a manageable agreement with our landlord that takes into account the complexities of running a restaurant under the limitations of Covid-19.” Uncle Boons has been closed since March.
The Uncle Boons restaurant team will focus all of their attention on their newer restaurant, Thai Diner - which has been operating with takeout, delivery, and seat-yourself outdoor dining using a combination of menu items from Uncle Boons, Uncle Boons Sister, and Thai Diner.
You can (sadly) stay updated with more of NYC’s restaurant closings here.
NYC restaurant news you can use from the week of 8/3/20.
27 outdoor dining options in NYC that are ideal for minimal contact.
Here’s what and when they’re cooking."
https://www.timeout.com/newyork/restaurants/new-years-eve-dinner-in-nyc,Timeout,"Toast to 2024 with these NYC New Year’s Eve prix fixe menus, à la carte options, open bars and all-night parties.
Don’t start 2024 cleaning up your kitchen! Whether you want to dine at one of NYC’s best restaurants before you hit a fabulous New Year’s Eve party or have a slice of pizza and a cocktail before falling asleep on the couch at 11pm, these prix fixe and à la carte options make for a memorable last meal of 2023. Feast on a mini buffet and an open bar a few minutes from the Times Square ball drop, put on your finest gown for a New Year’s Eve gala or stay local (and stay in your sweatpants)—these are the very best restaurants open on New Year’s Eve 2023 in NYC.
One of the very best special-occasion restaurants in Brooklyn is hosting a prix fixe dinner for New Year’s Eve. Festive canapés, root veggies with black truffle stracciatella, shrimp and grits with XO sauce and roasted Vermont lamb are featured on the four-course menu, with an optional wine pairing for an additional $85. They’re known for their baked Alaska, but a caramelized white chocolate mousse is another toasty way to toast the new year. Dinner is $175/pp, reservations available here.
Feel like ditching the prix fixe menus and getting a satisfying slice of tavern-style pizza, instead? Emmett’s is serving up celebratory appetizer towers stacked with pigs-in-blankets, meatball sliders, crispy fried olives and chicken parm along with their sharable pies. It’s way more laid-back than some of the other New Year’s Eve dinner destinations, so you can wear the same outfit you’ll rock on your couch while you watch When Harry Met Sally and fall asleep to the dulcet tones of Anderson Cooper. Price à la carte, reservations available here.
This Greek restaurant and “semi-private club” is always a little bit extra (like, they put gold leaf on tuna tartare), and this New Year’s Eve, they’re really taking it over the top. They’ve combined dinner and a party into one NYE extravaganza, with a caviar-heavy prix fixe menu and an appearance by their signature bespoke, interactive cocktail cart. If you’ve got an outfit that’s just begging to get seen, this is where you want to be at midnight. Dinner is $200/pp, reservations available here.
This 10,500 square-foot restaurant is about as Times Square as you can get (notwithstanding the iconic New Year’s Eve ball, of course). This year, Pink Taco will be hosting a NYE party with a “mini buffet” for those who want to be in Times Square but don’t want to have to wear an adult diaper while standing in the freezing cold. Tickets include a five hour open bar, so make sure to fill up on food during those early evening hours. Tickets start at $99, available here.
Ring in the New Year en français with foie gras mousse, panisse with meyer lemon, trout rillette and halibut with sauce américaine. This seasonal four-course prix fixe has an optional wine pairing, but you don’t want to miss their extensive list of Champagne. If you’re feeling super celebratory, a magnum is certainly the biggest (if not necessarily the best, depending on how you handle your hangovers) way to toast to 2024. Dinner is $165/pp, reservations available here.
Celebrate the beginning of 2024 with buckets of beautifully crispy fried chicken, flaky buttermilk biscuits served with seasonal jams, creamy coleslaw and—perhaps most importantly—1.5 hours of all the prosecco you can drink. For dessert, you’ll get to choose a slice of Bubby’s pie, which will surely pair beautifully with your fourth or fifth glass of bubbly. Dinner is $65/pp, reservations available here.
Don’t want to go into Manhattan to celebrate? We get it. This casual red sauce spot serves the neighborhood crowd—AKA the folks who have to get home to the sitter. Order the spaghetti pomodoro and the eggplant parm for a homey, satisfying send off to 2023. A classic cocktail or hearty pour of Chianti is plenty celebratory, and a tiramisu with two spoons is sometimes exactly what you need. Price à la carte, reservations available here.
Add a little uptown elegance to your evening at this black tie dinner. (If you’re doing the girl math on that dress you’ve only worn once, then wearing it again actually makes this dinner a bargain.) Their first seating, from 5 to 8pm, is a three-course prix fixe with lobster bisque, foie gras, dover sole and other fancy-to-fussy delights. Their second seating is a full New Year’s Eve gala, complete with Kristal caviar, a truffle course, a dessert tasting and a night of dancing in the Art Deco lobby. Dinner starts at $170/pp, reservations available here.
This scene-y spot (co-owned by Robert De Niro, no less) is offering up a New Year’s Eve prix fixe to celebrate another year in the history books. Tuna carpaccio, steak tartare, pumpkin agnolotti and duck cannelloni are featured on this play-the-hits menu, with Wagyu and black truffle polenta fries available for an upcharge. It’s glamorous and celebratory, but not too over-the-top, hitting the sweet spot for a night to remember. Dinner is $165, make a reservation here.
The hands-down winner of “most courses in the NYE prix fixe” is Phillipe Chow, where they’re offering up 16 courses (including but not limited to steamed dumplings, chicken satay, spring rolls, Chilean sea bass, kung pao chicken, lobster, peking duck, tableside cotton candy baked Alaska and a warm chocolate lava cake) worth of Beijing-style items. If you’re feeling bubbly, you can upgrade your dinner with a bottle of Perrier-Jouët Grand Brut. Dinner starts at $175/pp, reservations available here."
https://www.timeout.com/usa/news/a-fine-dining-restaurant-for-dogs-with-75-three-course-meal-opens-in-san-francisco-100622,Timeout,"Take canine cuisine to a whole new level in this exclusive eatery just for your four-legged friend.
A new fine-dining restaurant has opened in the Bay Area and it's exclusively for dogs. Yes, your hungry hound can enjoy bespoke meal plans tailored for your dogs’ age, weight, activity level, special needs and allergies.
Operated by Rahmi Massarweh and his wife Alejandra, Dogue offers only the finest and freshest ingredients for your canine companion. Rahmi explains on the website that he was formally a professional chef trained in classic French cuisine in San Francisco. The couple owned four dogs and inevitably soon found that their beloved pets were a bit picky. Before long, he was making fresh, healthy food for them... and not too long after that, they opened up what could very well be the first eatery in the US to serve a tasting menu exclusively for dogs.
Located in San Francisco’s Mission District (because where else would it be?) Dogue offers carefully crafted pastries from its in-house 'pawtisserie' and French-themed courses made with locally sourced, organic ingredients. A dog's dinner this is not.
During the week, the doggy diner serves Parisian pastries and 'dogguccinos' that start at $4.95. A $75 three-course meal, which is seasonal and frequently rotates, is served for Sunday walk-ins only. Pet owners can choose from a variety of dishes to serve their four-legged friends, such as green-lipped mussels with fermented carrots and wheatgrass or organic beef chuck steak with fermented carrots and beets or even squid tentacles and ink.
As the Instagram account for the extraordinary eatery explains, 'Squid contains riboflavin, vitamin B12, vitamin C, vitamin E, and several antioxidants, which might fight free radicals in your dog's body and reduce their risk of cell damage and infection from viruses and pathogens. It contains many vitamins and minerals, including zinc, copper, and B vitamins. It’s also a great source of protein and is low in fat,"" and so on.
Barking mad? Since its opening, the restaurant has received impassioned reaction from both critics and enthusiasts. On social media, people quickly labeled it as an 'only in San Francisco' story. Perhaps they're just barking up the wrong tree."
https://www.timeout.com/chicago/blog/zero-gravity-the-suburbs-trashiest-club-is-shutting-down-030816,Timeout,"If you grew up in the suburbs of Chicago, you're probably painfully aware of Zero Gravity, the Naperville nightclub that's open to only 16- to 24-year-olds. It's quite possibly the single trashiest place in the entire Chicago area, and it produces an endless stream of shameful photos of children dressed in garb that resembles apparel straight from an episode of Jersey Shore.
In a move that ought to bring a smile to the face of every discerning suburban father, the club announced that it will close for good later this month.
Zero Gravity, which markets itself as ""Chicagoland's #1 young adult dance club,"" will host one final party on Saturday, March 19 to honor all of the people who have danced their pants off (sometimes literally) at the spot over the past two decades. But even as the Naperville location is closing its doors, gross teen dance parties will still find a way to thrive in the Chicago area. In a Facebook post, Zero Gravity's owners announced they're planning on opening a ""bigger and newer club"" next fall."
https://www.thrillist.com/news/new-york/nyc-hosts-first-ever-espresso-martini-fest,Thrillist,"Coffee stans and happy hour fans assemble. The Espresso Martini Fest is coming to NYC.
After debuting its Espresso Martini Fest in Australia in 2016 and then bringing it to London, Mr. Black, the premium coffee liquor, is bringing the festival to selected cities across the US, and NYC is one of them luckily.
For a whole week, from May 16 through May 22, participating bars across the city will be offering $12 espresso martinis, and patrons who RSVP to the fest will be able to admire and taste different bartenders' takes on the iconic drink.
Famous cocktail venues will participate in the festival, like East Village local favorites Mister Paradise and Pretty Ricky's and Greenwich Village's beloved Dante. Brooklynites, instead, will be able to flock to Williamsburg's recent addition Thief and Hole in the Wall, among others, to sip on some caffeinated drinks.
Espresso martinis have been circulating in bars worldwide for years, but they're having something of a moment in the US.
""The Espresso Martini is a genuine modern classic cocktail. It's been consistently popular around the world for 10 years, and it's great to see the US having its coffee cocktail renaissance in 2022,"" Tom Baker, Founder of Mr. Black, said in a statement. ""Until we created Mr. Black in 2013, coffee was all but forgotten in the liquor industry—and now here we are working with some of the best bars in the US to showcase that very thing.""
New Yorkers will also be able to get a sneak peek of how the perfect espresso martini comes to life. Bea Bradsell, cocktail expert and daughter of the creator of the espresso martini, Dick Bradsell, will hold an exclusive masterclass in NYC at Little Ways on May 17. To RSVP, you can visit this link.
And to keep the espresso martini party going, Mr. Black has also partnered with Dante for a special (and free!) Espresso Martini Fest event. Featuring some of the city's top bartenders like Channing Centeno from Bonnie's, Sam Casuga of Temple Bar, Leanne Favre of Clover Club, and Adam Montgomery from Hawksmoor, the event will take place at Dante's new Seaport location. To participate, guests only need to RSVP here. They will receive a complimentary espresso martini upon arrival and will be able to purchase $12 espresso martinis throughout the night.
You can visit this link for more information about the festival and its other US locations."
https://www.thrillist.com/news/nation/taco-bell-menu-change-august-2020-removing-items,Thrillist,"At this point, it's safe to say that 2020... has, well, not been what we expected. And as if we weren't dealing with enough uncertainty, Taco Bell is throwing another curve ball our way. The chain announced Friday that it's officially cutting several items from its nationwide menu next month -- just days after the information was leaked by employees on Reddit.
""Beginning August 13, we will be simplifying our menu to streamline operations,"" Taco Bell stated in a press release. ""This evolved menu approach comes after months of analyzing the new way we are running our restaurants. With safety top of mind, we want to ensure an easy and fast ordering experience for our guests and team members.""
T-Bell provided the following list of 13 menu items it's ""saying goodbye to"" when the menu change goes into effect: Grilled Steak Soft Taco, 7-Layer Burrito, Nachos Supreme, Beefy Fritos Burrito, Spicy Tostada, Triple Layer Nachos, Spicy Potato Soft Taco, Cheesy Fiesta Potatoes, Cheesy Potato Loaded Griller, Beefy Nacho Loaded Griller, Mini Skillet Bowl (breakfast), and\ two of its Chips & Dips (Chips and Guacamole and Chips and Pico De Gallo). While the Quesarito was rumored to be getting the axe as well, it turns out you'll still be able to get it if you order via the Taco Bell mobile app or the chain's website.
When reached by Thrillist, a spokesperson for the chain confirmed that the beloved potato ingredient will be completely removed from the menu.
Word of the cuts emerged on Reddit this week, including a post shared by a ""verified"" employee. At the time, Taco Bell wouldn't confirm the information, but several other posts to the /r/LivingMas and /r/TacoBell subreddits backed up the claims. The internet understandably was in full-on outrage mode (myself included).
It's worth pointing out that some fans on the /r/TacoBell subreddit said they can understand why Taco Bell would make cuts right now, considering we're in the middle of a pandemic, employees are likely stressed, and other related factors. The company says as much in a further explanation for the menu slashes.
""As we move forward, we will continue to lean into learnings from our restaurants to strive for a Taco Bell experience that is safe, fast, and efficient for all,"" Taco Bell said, per the press release.
Of course, this isn't the first time Taco Bell has done us dirty. Back in 2019, the Mexican-style fast food joint dropped nine menu items, including the double decker taco and the Cool Ranch Doritos Locos Taco (RIP). If you missed the chance to eat the items that were cut last time, don't make the same mistake this time.
""We encourage fans to snag the [discontinued] menu items over the next few weeks before discovering new favorites,"" Taco Bell said."
